{
  "$schema": "https://json-schema.org/draft/2020-12/schema",
  "$id": "https://schemas.testbraid.invalid/v1/test.schema.json",
  "type": "object",
  "required": [
    "schemaVersion",
    "id",
    "groupId",
    "language",
    "title",
    "description",
    "status",
    "createdAt",
    "updatedAt",
    "publishedAt",
    "questions"
  ],
  "properties": {
    "schemaVersion": {
      "const": 1
    },
    "id": {
      "type": "string",
      "minLength": 1,
      "maxLength": 128,
      "pattern": "^[A-Za-z0-9][A-Za-z0-9._-]*$"
    },
    "groupId": {
      "type": "string",
      "minLength": 1,
      "maxLength": 128,
      "pattern": "^[A-Za-z0-9][A-Za-z0-9._-]*$"
    },
    "language": {
      "type": "string",
      "pattern": "^[A-Za-z]{2,8}(?:-[A-Za-z0-9]{1,8})*$"
    },
    "title": {
      "type": "string",
      "maxLength": 250
    },
    "description": {
      "type": "string",
      "maxLength": 50000
    },
    "status": {
      "enum": [
        "draft",
        "published"
      ]
    },
    "createdAt": {
      "type": "string",
      "pattern": "^\\d{4}-\\d{2}-\\d{2}T\\d{2}:\\d{2}:\\d{2}(?:\\.\\d+)?Z$"
    },
    "updatedAt": {
      "type": "string",
      "pattern": "^\\d{4}-\\d{2}-\\d{2}T\\d{2}:\\d{2}:\\d{2}(?:\\.\\d+)?Z$"
    },
    "publishedAt": {
      "anyOf": [
        {
          "type": "null"
        },
        {
          "type": "string",
          "pattern": "^\\d{4}-\\d{2}-\\d{2}T\\d{2}:\\d{2}:\\d{2}(?:\\.\\d+)?Z$"
        }
      ]
    },
    "questions": {
      "type": "array",
      "items": {
        "oneOf": [
          {
            "$ref": "choice-question.schema.json"
          },
          {
            "$ref": "matching-question.schema.json"
          }
        ]
      }
    }
  },
  "additionalProperties": false
}
